CREATE TABLE Category (
  2      Category_ID NUMBER PRIMARY KEY,
  3      Category_Name VARCHAR2(50) NOT NULL UNIQUE
  4  );

Table created.

SQL> CREATE TABLE Product (
  2      Product_ID NUMBER PRIMARY KEY,
  3      Product_Name VARCHAR2(100) NOT NULL,
  4      Brand VARCHAR2(50) NOT NULL,
  5      Price NUMBER(10,2) NOT NULL,
  6      Stock NUMBER NOT NULL,
  7      Category_ID NUMBER,
  8      FOREIGN KEY (Category_ID) REFERENCES Category(Category_ID)
  9  );

Table created.

SQL> INSERT INTO Category (Category_ID, Category_Name)
  2  VALUES (1, 'Eyeglasses');

1 row created.

SQL> 
SQL> INSERT INTO Category (Category_ID, Category_Name)
  2  VALUES (2, 'Sunglasses');

1 row created.

SQL> 
SQL> INSERT INTO Category (Category_ID, Category_Name)
  2  VALUES (3, 'Contact Lenses');

1 row created.

SQL> 
SQL> INSERT INTO Category (Category_ID, Category_Name)
  2  VALUES (4, 'Kids Eyewear');

1 row created.

SQL> INSERT INTO Product
  2  (Product_ID, Product_Name, Brand, Price, Stock, Category_ID)
  3  VALUES
  4  (101, 'Air Flex Eyeglasses', 'Lenskart Air', 1500.00, 25, 1);

1 row created.

SQL> 
SQL> INSERT INTO Product
  2  (Product_ID, Product_Name, Brand, Price, Stock, Category_ID)
  3  VALUES
  4  (102, 'Classic Round Eyeglasses', 'Vincent Chase', 2000.00, 15, 1);

1 row created.

SQL> 
SQL> INSERT INTO Product
  2  (Product_ID, Product_Name, Brand, Price, Stock, Category_ID)
  3  VALUES
  4  (103, 'Polarized Sunglasses', 'Vincent Chase', 1800.00, 20, 2);

1 row created.

SQL> 
SQL> INSERT INTO Product
  2  (Product_ID, Product_Name, Brand, Price, Stock, Category_ID)
  3  VALUES
  4  (104, 'Daily Contact Lenses', 'Aqualens', 900.00, 30, 3);

1 row created.

SQL> 
SQL> INSERT INTO Product
  2  (Product_ID, Product_Name, Brand, Price, Stock, Category_ID)
  3  VALUES
  4  (105, 'Kids Round Eyeglasses', 'Lenskart', 1200.00, 10, 4);

1 row created.

SQL> SELECT * FROM Product;

PRODUCT_ID
----------
PRODUCT_NAME
--------------------------------------------------------------------------------
BRAND                                                   PRICE      STOCK
-------------------------------------------------- ---------- ----------
CATEGORY_ID
-----------
       101
Air Flex Eyeglasses
Lenskart Air                                             1500         25
          1


PRODUCT_ID
----------
PRODUCT_NAME
--------------------------------------------------------------------------------
BRAND                                                   PRICE      STOCK
-------------------------------------------------- ---------- ----------
CATEGORY_ID
-----------
       102
Classic Round Eyeglasses
Vincent Chase                                            2000         15
          1


PRODUCT_ID
----------
PRODUCT_NAME
--------------------------------------------------------------------------------
BRAND                                                   PRICE      STOCK
-------------------------------------------------- ---------- ----------
CATEGORY_ID
-----------
       103
Polarized Sunglasses
Vincent Chase                                            1800         20
          2


PRODUCT_ID
----------
PRODUCT_NAME
--------------------------------------------------------------------------------
BRAND                                                   PRICE      STOCK
-------------------------------------------------- ---------- ----------
CATEGORY_ID
-----------
       104
Daily Contact Lenses
Aqualens                                                  900         30
          3


PRODUCT_ID
----------
PRODUCT_NAME
--------------------------------------------------------------------------------
BRAND                                                   PRICE      STOCK
-------------------------------------------------- ---------- ----------
CATEGORY_ID
-----------
       105
Kids Round Eyeglasses
Lenskart                                                 1200         10
          4


SQL> UPDATE Product
  2  SET Price = 1600.00,
  3      Stock = 30
  4  WHERE Product_ID = 101;

1 row updated.

SQL> SELECT * FROM Product
  2  WHERE Product_ID = 101;

PRODUCT_ID
----------
PRODUCT_NAME
--------------------------------------------------------------------------------
BRAND                                                   PRICE      STOCK
-------------------------------------------------- ---------- ----------
CATEGORY_ID
-----------
       101
Air Flex Eyeglasses
Lenskart Air                                             1600         30
          1


SQL> DELETE FROM Product
  2  WHERE Product_ID = 105;

1 row deleted.

SQL> SELECT * FROM Product;

PRODUCT_ID
----------
PRODUCT_NAME
--------------------------------------------------------------------------------
BRAND                                                   PRICE      STOCK
-------------------------------------------------- ---------- ----------
CATEGORY_ID
-----------
       101
Air Flex Eyeglasses
Lenskart Air                                             1600         30
          1


PRODUCT_ID
----------
PRODUCT_NAME
--------------------------------------------------------------------------------
BRAND                                                   PRICE      STOCK
-------------------------------------------------- ---------- ----------
CATEGORY_ID
-----------
       102
Classic Round Eyeglasses
Vincent Chase                                            2000         15
          1


PRODUCT_ID
----------
PRODUCT_NAME
--------------------------------------------------------------------------------
BRAND                                                   PRICE      STOCK
-------------------------------------------------- ---------- ----------
CATEGORY_ID
-----------
       103
Polarized Sunglasses
Vincent Chase                                            1800         20
          2


PRODUCT_ID
----------
PRODUCT_NAME
--------------------------------------------------------------------------------
BRAND                                                   PRICE      STOCK
-------------------------------------------------- ---------- ----------
CATEGORY_ID
-----------
       104
Daily Contact Lenses
Aqualens                                                  900         30
          3


SQL> SELECT
  2      c.Category_Name,
  3      p.Product_ID,
  4      p.Product_Name,
  5      p.Brand,
  6      p.Price,
  7      p.Stock
  8  FROM Category c
  9  JOIN Product p
 10  ON c.Category_ID = p.Category_ID
 11  ORDER BY c.Category_Name;

CATEGORY_NAME                                      PRODUCT_ID
-------------------------------------------------- ----------
PRODUCT_NAME
--------------------------------------------------------------------------------
BRAND                                                   PRICE      STOCK
-------------------------------------------------- ---------- ----------
Contact Lenses                                            104
Daily Contact Lenses
Aqualens                                                  900         30

Eyeglasses                                                101
Air Flex Eyeglasses
Lenskart Air                                             1600         30

CATEGORY_NAME                                      PRODUCT_ID
-------------------------------------------------- ----------
PRODUCT_NAME
--------------------------------------------------------------------------------
BRAND                                                   PRICE      STOCK
-------------------------------------------------- ---------- ----------

Eyeglasses                                                102
Classic Round Eyeglasses
Vincent Chase                                            2000         15

Sunglasses                                                103
Polarized Sunglasses

CATEGORY_NAME                                      PRODUCT_ID
-------------------------------------------------- ----------
PRODUCT_NAME
--------------------------------------------------------------------------------
BRAND                                                   PRICE      STOCK
-------------------------------------------------- ---------- ----------
Vincent Chase                                            1800         20
